context,keywords,guidance
studying,"study studying focus homework quiet","Prefer songs with low or medium energy, softer textures, and fewer abrupt changes."
workout,"workout gym running chaotic intense","Prefer high-energy songs with strong rhythm, speed, and momentum."
night walk,"night walking city lonely dreamy","Prefer atmospheric songs with emotional texture and a sense of movement."
party,"party dancing hype energetic","Prefer songs with high energy, strong beats, and immediate hooks."
reflection,"sad reflective crying journaling emotional","Prefer emotionally direct songs with slower pacing and lyrical weight."
